<?xml version="1.0" encoding="UTF-8"?>
<xsd:schema xmlns:xsd="http://www.w3.org/2001/XMLSchema" xmlns:od="urn:schemas-microsoft-com:officedata">
<xsd:element name="dataroot">
<xsd:complexType>
<xsd:sequence>
<xsd:element ref="Water" minOccurs="0" maxOccurs="unbounded"/>
</xsd:sequence>
<xsd:attribute name="generated" type="xsd:dateTime"/>
</xsd:complexType>
</xsd:element>
<xsd:element name="Water">
<xsd:annotation>
<xsd:appinfo>
<od:tableProperty name="GUID" type="9" value="j/Pp83HQE0qsf8gYS8i7vQ==
"/>
<od:tableProperty name="Orientation" type="2" value="0"/>
<od:tableProperty name="OrderByOn" type="1" value="0"/>
<od:tableProperty name="NameMap" type="11" value="CswOVQAAAACP8+nzcdATSqx/yBhLyLu9AAAAAPgTbU/3eOVAAAAAAAAAAABXAGEA
dABlAHIAAAAAAAAALcH0KI1MB0C6aw+0OWFoEQcAAACP8+nzcdATSqx/yBhLyLu9
TgBhAG0AZQAAAAAAAACOEA47/6/LTZRqPMxVsrEGBwAAAI/z6fNx0BNKrH/IGEvI
u71DAGEAbABjAGkAdQBtAAAAAAAAACTqOVwqk/VKtXwlbZpT7zYHAAAAj/Pp83HQ
E0qsf8gYS8i7vU0AYQBnAG4AZQBzAGkAdQBtAAAAAAAAAJczZvJTWDNHkzId4Prq
XG0HAAAAj/Pp83HQE0qsf8gYS8i7vVMAdQBsAGYAYQB0AGUAAAAAAAAAEWBM/uT3
LUqlr+fJ17gA0AcAAACP8+nzcdATSqx/yBhLyLu9UwBvAGQAaQB1AG0AAAAAAAAA
17OH7Pzg40WlEwBt/Cae+AcAAACP8+nzcdATSqx/yBhLyLu9QwBoAGwAbwByAGkA
ZABlAAAAAAAAAKvtP8O2BVpDuf65L9M7kd4HAAAAj/Pp83HQE0qsf8gYS8i7vUIA
aQBjAGEAcgBiAG8AbgBhAHQAZQAAAAAAAAAHV/ercwOvSbhgnJJNtGjZBwAAAI/z
6fNx0BNKrH/IGEvIu71GAGkAZQBsAGQAOAAAAAAAAAAAAAAAAAAAAAAAAAAAAAAA
DAAAAAUAAAAAAAAAAAAAAAAAAAAAAA==
"/>
<od:tableProperty name="DefaultView" type="2" value="2"/>
<od:tableProperty name="DisplayViewsOnSharePointSite" type="2" value="1"/>
<od:tableProperty name="TotalsRow" type="1" value="0"/>
<od:tableProperty name="FilterOnLoad" type="1" value="0"/>
<od:tableProperty name="OrderByOnLoad" type="1" value="1"/>
<od:tableProperty name="HideNewField" type="1" value="0"/>
<od:tableProperty name="BackTint" type="6" value="100"/>
<od:tableProperty name="BackShade" type="6" value="100"/>
<od:tableProperty name="ThemeFontIndex" type="4" value="-1"/>
<od:tableProperty name="AlternateBackThemeColorIndex" type="4" value="-1"/>
<od:tableProperty name="AlternateBackTint" type="6" value="100"/>
<od:tableProperty name="AlternateBackShade" type="6" value="100"/>
<od:tableProperty name="ReadOnlyWhenDisconnected" type="1" value="0"/>
<od:tableProperty name="DatasheetGridlinesThemeColorIndex" type="4" value="-1"/>
<od:tableProperty name="DatasheetForeThemeColorIndex" type="4" value="-1"/>
<od:tableProperty name="PublishToWeb" type="2" value="1"/>
</xsd:appinfo>
</xsd:annotation>
<xsd:complexType>
<xsd:sequence>
<xsd:element name="Name" minOccurs="0" od:jetType="text" od:sqlSType="nvarchar">
<xsd:annotation>
<xsd:appinfo>
<od:fieldProperty name="Format" type="10" value="@"/>
<od:fieldProperty name="GUID" type="9" value="LcH0KI1MB0C6aw+0OWFoEQ==
"/>
<od:fieldProperty name="ColumnWidth" type="3" value="-1"/>
<od:fieldProperty name="ColumnOrder" type="3" value="0"/>
<od:fieldProperty name="ColumnHidden" type="1" value="0"/>
<od:fieldProperty name="Required" type="1" value="0"/>
<od:fieldProperty name="AllowZeroLength" type="1" value="1"/>
<od:fieldProperty name="DisplayControl" type="3" value="109"/>
<od:fieldProperty name="IMEMode" type="2" value="0"/>
<od:fieldProperty name="IMESentenceMode" type="2" value="3"/>
<od:fieldProperty name="UnicodeCompression" type="1" value="0"/>
<od:fieldProperty name="TextAlign" type="2" value="0"/>
<od:fieldProperty name="AggregateType" type="4" value="-1"/>
<od:fieldProperty name="ResultType" type="2" value="0"/>
<od:fieldProperty name="CurrencyLCID" type="4" value="0"/>
</xsd:appinfo>
</xsd:annotation>
<xsd:simpleType>
<xsd:restriction base="xsd:string">
<xsd:maxLength value="255"/>
</xsd:restriction>
</xsd:simpleType>
</xsd:element>
<xsd:element name="Calcium" minOccurs="0" od:jetType="double" od:sqlSType="float" type="xsd:double">
<xsd:annotation>
<xsd:appinfo>
<od:fieldProperty name="Format" type="10" value="General Number"/>
<od:fieldProperty name="GUID" type="9" value="jhAOO/+vy02UajzMVbKxBg==
"/>
<od:fieldProperty name="ColumnWidth" type="3" value="-1"/>
<od:fieldProperty name="ColumnOrder" type="3" value="0"/>
<od:fieldProperty name="ColumnHidden" type="1" value="0"/>
<od:fieldProperty name="DecimalPlaces" type="2" value="255"/>
<od:fieldProperty name="Required" type="1" value="0"/>
<od:fieldProperty name="DisplayControl" type="3" value="109"/>
<od:fieldProperty name="TextAlign" type="2" value="0"/>
<od:fieldProperty name="AggregateType" type="4" value="-1"/>
<od:fieldProperty name="ResultType" type="2" value="0"/>
<od:fieldProperty name="CurrencyLCID" type="4" value="0"/>
</xsd:appinfo>
</xsd:annotation>
</xsd:element>
<xsd:element name="Magnesium" minOccurs="0" od:jetType="double" od:sqlSType="float" type="xsd:double">
<xsd:annotation>
<xsd:appinfo>
<od:fieldProperty name="Format" type="10" value="General Number"/>
<od:fieldProperty name="GUID" type="9" value="JOo5XCqT9Uq1fCVtmlPvNg==
"/>
<od:fieldProperty name="ColumnWidth" type="3" value="-1"/>
<od:fieldProperty name="ColumnOrder" type="3" value="0"/>
<od:fieldProperty name="ColumnHidden" type="1" value="0"/>
<od:fieldProperty name="DecimalPlaces" type="2" value="255"/>
<od:fieldProperty name="Required" type="1" value="0"/>
<od:fieldProperty name="DisplayControl" type="3" value="109"/>
<od:fieldProperty name="TextAlign" type="2" value="0"/>
<od:fieldProperty name="AggregateType" type="4" value="-1"/>
<od:fieldProperty name="ResultType" type="2" value="0"/>
<od:fieldProperty name="CurrencyLCID" type="4" value="0"/>
</xsd:appinfo>
</xsd:annotation>
</xsd:element>
<xsd:element name="Sulfate" minOccurs="0" od:jetType="double" od:sqlSType="float" type="xsd:double">
<xsd:annotation>
<xsd:appinfo>
<od:fieldProperty name="Format" type="10" value="General Number"/>
<od:fieldProperty name="GUID" type="9" value="lzNm8lNYM0eTMh3g+upcbQ==
"/>
<od:fieldProperty name="ColumnWidth" type="3" value="-1"/>
<od:fieldProperty name="ColumnOrder" type="3" value="0"/>
<od:fieldProperty name="ColumnHidden" type="1" value="0"/>
<od:fieldProperty name="DecimalPlaces" type="2" value="255"/>
<od:fieldProperty name="Required" type="1" value="0"/>
<od:fieldProperty name="DisplayControl" type="3" value="109"/>
<od:fieldProperty name="TextAlign" type="2" value="0"/>
<od:fieldProperty name="AggregateType" type="4" value="-1"/>
<od:fieldProperty name="ResultType" type="2" value="0"/>
<od:fieldProperty name="CurrencyLCID" type="4" value="0"/>
</xsd:appinfo>
</xsd:annotation>
</xsd:element>
<xsd:element name="Sodium" minOccurs="0" od:jetType="double" od:sqlSType="float" type="xsd:double">
<xsd:annotation>
<xsd:appinfo>
<od:fieldProperty name="Format" type="10" value="General Number"/>
<od:fieldProperty name="GUID" type="9" value="EWBM/uT3LUqlr+fJ17gA0A==
"/>
<od:fieldProperty name="ColumnWidth" type="3" value="-1"/>
<od:fieldProperty name="ColumnOrder" type="3" value="0"/>
<od:fieldProperty name="ColumnHidden" type="1" value="0"/>
<od:fieldProperty name="DecimalPlaces" type="2" value="255"/>
<od:fieldProperty name="Required" type="1" value="0"/>
<od:fieldProperty name="DisplayControl" type="3" value="109"/>
<od:fieldProperty name="TextAlign" type="2" value="0"/>
<od:fieldProperty name="AggregateType" type="4" value="-1"/>
<od:fieldProperty name="ResultType" type="2" value="0"/>
<od:fieldProperty name="CurrencyLCID" type="4" value="0"/>
</xsd:appinfo>
</xsd:annotation>
</xsd:element>
<xsd:element name="Chloride" minOccurs="0" od:jetType="double" od:sqlSType="float" type="xsd:double">
<xsd:annotation>
<xsd:appinfo>
<od:fieldProperty name="Format" type="10" value="General Number"/>
<od:fieldProperty name="GUID" type="9" value="17OH7Pzg40WlEwBt/Cae+A==
"/>
<od:fieldProperty name="ColumnWidth" type="3" value="-1"/>
<od:fieldProperty name="ColumnOrder" type="3" value="0"/>
<od:fieldProperty name="ColumnHidden" type="1" value="0"/>
<od:fieldProperty name="DecimalPlaces" type="2" value="255"/>
<od:fieldProperty name="Required" type="1" value="0"/>
<od:fieldProperty name="DisplayControl" type="3" value="109"/>
<od:fieldProperty name="TextAlign" type="2" value="0"/>
<od:fieldProperty name="AggregateType" type="4" value="-1"/>
<od:fieldProperty name="ResultType" type="2" value="0"/>
<od:fieldProperty name="CurrencyLCID" type="4" value="0"/>
</xsd:appinfo>
</xsd:annotation>
</xsd:element>
<xsd:element name="Bicarbonate" minOccurs="0" od:jetType="double" od:sqlSType="float" type="xsd:double">
<xsd:annotation>
<xsd:appinfo>
<od:fieldProperty name="Format" type="10" value="General Number"/>
<od:fieldProperty name="GUID" type="9" value="q+0/w7YFWkO5/rkv0zuR3g==
"/>
<od:fieldProperty name="ColumnWidth" type="3" value="-1"/>
<od:fieldProperty name="ColumnOrder" type="3" value="0"/>
<od:fieldProperty name="ColumnHidden" type="1" value="0"/>
<od:fieldProperty name="DecimalPlaces" type="2" value="255"/>
<od:fieldProperty name="Required" type="1" value="0"/>
<od:fieldProperty name="DisplayControl" type="3" value="109"/>
<od:fieldProperty name="TextAlign" type="2" value="0"/>
<od:fieldProperty name="AggregateType" type="4" value="-1"/>
<od:fieldProperty name="ResultType" type="2" value="0"/>
<od:fieldProperty name="CurrencyLCID" type="4" value="0"/>
</xsd:appinfo>
</xsd:annotation>
</xsd:element>
<xsd:element name="Field8" minOccurs="0" od:jetType="text" od:sqlSType="nvarchar">
<xsd:annotation>
<xsd:appinfo>
<od:fieldProperty name="Format" type="10" value="@"/>
<od:fieldProperty name="GUID" type="9" value="B1f3q3MDr0m4YJySTbRo2Q==
"/>
<od:fieldProperty name="ColumnWidth" type="3" value="-1"/>
<od:fieldProperty name="ColumnOrder" type="3" value="0"/>
<od:fieldProperty name="ColumnHidden" type="1" value="0"/>
<od:fieldProperty name="Required" type="1" value="0"/>
<od:fieldProperty name="AllowZeroLength" type="1" value="1"/>
<od:fieldProperty name="DisplayControl" type="3" value="109"/>
<od:fieldProperty name="IMEMode" type="2" value="0"/>
<od:fieldProperty name="IMESentenceMode" type="2" value="3"/>
<od:fieldProperty name="UnicodeCompression" type="1" value="0"/>
<od:fieldProperty name="TextAlign" type="2" value="0"/>
<od:fieldProperty name="AggregateType" type="4" value="-1"/>
<od:fieldProperty name="ResultType" type="2" value="0"/>
<od:fieldProperty name="CurrencyLCID" type="4" value="0"/>
</xsd:appinfo>
</xsd:annotation>
<xsd:simpleType>
<xsd:restriction base="xsd:string">
<xsd:maxLength value="255"/>
</xsd:restriction>
</xsd:simpleType>
</xsd:element>
</xsd:sequence>
</xsd:complexType>
</xsd:element>
</xsd:schema>
