<?xml version="1.0" encoding="UTF-8"?>
<dataroot xmlns:od="urn:schemas-microsoft-com:officedata" xmlns:xsi="http://www.w3.org/2001/XMLSchema-instance"  xsi:noNamespaceSchemaLocation="Water.xsd" generated="2020-05-24T17:36:46">
<Water>
<Name>Balanced</Name>
<Calcium>80</Calcium>
<Magnesium>5</Magnesium>
<Sulfate>80</Sulfate>
<Sodium>25</Sodium>
<Chloride>75</Chloride>
<Bicarbonate>100</Bicarbonate>
</Water>
<Water>
<Name>Balanced II</Name>
<Calcium>150</Calcium>
<Magnesium>10</Magnesium>
<Sulfate>160</Sulfate>
<Sodium>80</Sodium>
<Chloride>150</Chloride>
<Bicarbonate>220</Bicarbonate>
</Water>
<Water>
<Name>Burton</Name>
<Calcium>275</Calcium>
<Magnesium>40</Magnesium>
<Sulfate>610</Sulfate>
<Sodium>25</Sodium>
<Chloride>35</Chloride>
<Bicarbonate>270</Bicarbonate>
</Water>
<Water>
<Name>Dusseldorf (Altbier)</Name>
<Calcium>90</Calcium>
<Magnesium>12</Magnesium>
<Sulfate>45</Sulfate>
<Sodium>82</Sodium>
<Chloride>65</Chloride>
<Bicarbonate>223</Bicarbonate>
</Water>
<Water>
<Name>Dortmund</Name>
<Calcium>230</Calcium>
<Magnesium>15</Magnesium>
<Sulfate>330</Sulfate>
<Sodium>40</Sodium>
<Chloride>130</Chloride>
<Bicarbonate>235</Bicarbonate>
</Water>
<Water>
<Name>Dublin (Dry Stout)</Name>
<Calcium>120</Calcium>
<Magnesium>4</Magnesium>
<Sulfate>55</Sulfate>
<Sodium>12</Sodium>
<Chloride>19</Chloride>
<Bicarbonate>315</Bicarbonate>
</Water>
<Water>
<Name>Edinburgh (Scottish/Malty Ale)</Name>
<Calcium>100</Calcium>
<Magnesium>20</Magnesium>
<Sulfate>140</Sulfate>
<Sodium>55</Sodium>
<Chloride>50</Chloride>
<Bicarbonate>285</Bicarbonate>
</Water>
<Water>
<Name>Malty Balanced</Name>
<Calcium>90</Calcium>
<Magnesium>5</Magnesium>
<Sulfate>60</Sulfate>
<Sodium>25</Sodium>
<Chloride>95</Chloride>
<Bicarbonate>100</Bicarbonate>
</Water>
<Water>
<Name>London (Porter)</Name>
<Calcium>70</Calcium>
<Magnesium>6</Magnesium>
<Sulfate>40</Sulfate>
<Sodium>15</Sodium>
<Chloride>38</Chloride>
<Bicarbonate>166</Bicarbonate>
</Water>
<Water>
<Name>Munich (Dark Lager)</Name>
<Calcium>77</Calcium>
<Magnesium>17</Magnesium>
<Sulfate>18</Sulfate>
<Sodium>4</Sodium>
<Chloride>8</Chloride>
<Bicarbonate>295</Bicarbonate>
</Water>
<Water>
<Name>Pilsen (Light Lager)</Name>
<Calcium>7</Calcium>
<Magnesium>2</Magnesium>
<Sulfate>8</Sulfate>
<Sodium>2</Sodium>
<Chloride>6</Chloride>
<Bicarbonate>16</Bicarbonate>
</Water>
<Water>
<Name>Vienna</Name>
<Calcium>75</Calcium>
<Magnesium>15</Magnesium>
<Sulfate>60</Sulfate>
<Sodium>10</Sodium>
<Chloride>15</Chloride>
<Bicarbonate>225</Bicarbonate>
</Water>
<Water>
<Name>Light &amp; Hoppy</Name>
<Calcium>75</Calcium>
<Magnesium>5</Magnesium>
<Sulfate>150</Sulfate>
<Sodium>10</Sodium>
<Chloride>50</Chloride>
<Bicarbonate>0</Bicarbonate>
</Water>
<Water>
<Name>Light &amp; Malty</Name>
<Calcium>60</Calcium>
<Magnesium>5</Magnesium>
<Sulfate>55</Sulfate>
<Sodium>10</Sodium>
<Chloride>95</Chloride>
<Bicarbonate>0</Bicarbonate>
</Water>
</dataroot>
